{"format":{"name":"BOM Engine Model-Eval JSON","version":"1.0.0","identifier":"model_eval_json_v1","schema":"https://sibambo.dev/schemas/bom-engine/model-eval-json/1.0.0/schema.json"},"units":"m","coordinate_system":{"handedness":"right","up_axis":"+Z","threejs_mapping":"{x,y,z}->{x,z,-y}"},"source":[0,1,2,3],"strings":["example.skp","Compact example","model","2026-07-13T00:00:00Z","material:brick","Brick","#AA5522","tag:0","Untagged","mesh:panel","face:1","1","floor","definition:root","Root","root","definition:panel","Panel","component_definition","node:root","node:panel:1","Panel 1"],"materials":[[4,5,6,1]],"tags":[[7,8,true]],"transforms":[1,0,0,0,0,1,0,0,0,0,1,0,0,0,0,1,1,0,0,0,0,1,0,0,0,0,1,0,1,0,0,1],"meshes":[{"id":9,"definition":1,"vertex_count":4,"triangle_count":2,"quantization":{"component_type":"uint16","minimum_m":[0,0,0],"maximum_m":[1,1,0],"scale_m":[0.0000152590218967,0.0000152590218967,0],"measured_max_error_m":0,"error_budget_m":0.001},"positions":[0,0,0,65535,0,0,65535,65535,0,0,65535,0],"loops":[0,1,2,3],"triangles":[0,1,2,0,2,3],"faces":[[10,11,0,4,[],0,6,0,-1,0,12,1]]}],"definitions":[[13,14,15,-1,[1]],[16,17,18,0,[]]],"nodes":[[19,14,1,0,0,-1,-1,true,-1],[20,21,2,1,1,-1,0,true,-1]],"root_node":0,"statistics":{"unique_meshes":1,"definitions":2,"nodes":2,"component_instances":1,"group_instances":0,"unique_vertices":4,"triangles":2}}
